"WASTE MANAGEMENT OF ARIZONA, INC.",PHOENIX,AZ,"Ms. Doreen M. Seklar, Manager"
REDBURN TIRE COMPANY,PHOENIX,AZ,
CREATIVE TESTING SOLUTIONS,TEMPE,AZ,
CYTEC ENGINEERED MATERIALS INC.,TEMPE,AZ,
"SMARTHEALTH, INC.",PHOENIX,AZ,"Mr. Curt P. Hamann, President"
"AMERICAN TRAFFIC SOLUTIONS CONSOLIDATED, L.L.C.",MESA,AZ,
OXFORD LIFE INSURANCE COMPANY INC,PHOENIX,AZ,"Mr. Michael R Oxford, President"
"PARADIGM PRECISION HOLDINGS, LLC",TEMPE,AZ,
THE TECH GROUP INC,SCOTTSDALE,AZ,"Mr. Steve Rasmussen, CEO"
KALIL BOTTLING CO,TUCSON,AZ,"Mr. George Kalil, President"
